<?xml version="1.0" encoding="UTF-8"?>
<Propis xmlns="http://www.ftn.uns.ac.rs/pravniAkt"
    xmlns:xsi="http://www.w3.org/2001/XMLSchema-instance"
    xsi:schemaLocation="http://www.ftn.uns.ac.rs/pravniAkt file:/C:/Users/Milos/Documents/busep/schema/akt.xsd">
    <Preambula></Preambula>
    <SimbolickiNaziv></SimbolickiNaziv>
    <Naziv></Naziv>
    <UvodniDeo>
        <RedniBrojDela>1</RedniBrojDela>
        <SimbolickiNazivDela></SimbolickiNazivDela>
        <NazivDela/>
        <Glava>
            <RedniBrojGlave>1</RedniBrojGlave>
            <SimbolickiNazivGlave></SimbolickiNazivGlave>
            <NazivGlave></NazivGlave>
            <OdeljakIliClan><Clan>
                <RedniBrojClana></RedniBrojClana>
                <SimbolickiNazivClana></SimbolickiNazivClana>
                <StavClana>
                    <TekstStava></TekstStava>
                </StavClana>
            </Clan></OdeljakIliClan>
        </Glava>
        <PredmetUredjivanja></PredmetUredjivanja>
    </UvodniDeo>
    <GlavniDeo>
        <RedniBrojDela>1</RedniBrojDela>
        <SimbolickiNazivDela></SimbolickiNazivDela>
        <NazivDela/>
        <Glava>
            <RedniBrojGlave>1</RedniBrojGlave>
            <SimbolickiNazivGlave></SimbolickiNazivGlave>
            <NazivGlave></NazivGlave>
            <OdeljakIliClan><Clan>
                <RedniBrojClana></RedniBrojClana>
                <SimbolickiNazivClana></SimbolickiNazivClana>
                <StavClana>
                    <TekstStava></TekstStava>
                </StavClana>
            </Clan></OdeljakIliClan>
        </Glava>
    </GlavniDeo>
    <ZavrsniDeo>
        <RedniBrojDela>1</RedniBrojDela>
        <SimbolickiNazivDela></SimbolickiNazivDela>
        <NazivDela/>
        <Glava>
            <RedniBrojGlave>1</RedniBrojGlave>
            <SimbolickiNazivGlave></SimbolickiNazivGlave>
            <NazivGlave></NazivGlave>
            <OdeljakIliClan><Clan>
                <RedniBrojClana></RedniBrojClana>
                <SimbolickiNazivClana></SimbolickiNazivClana>
                <StavClana>
                    <TekstStava></TekstStava>
                </StavClana>
            </Clan></OdeljakIliClan>
        </Glava>
    </ZavrsniDeo>
</Propis>