<?xml version="1.0" encoding="UTF-8"?><Propis xmlns="http://www.ftn.uns.ac.rs/pravniAkt" xmlns:xsi="http://www.w3.org/2001/XMLSchema-instance" xsi:schemaLocation="http://www.ftn.uns.ac.rs/pravniAkt file:/C:/Users/Milos/Documents/busep/schema/akt.xsd">
    <Preambula><xenc:EncryptedData xmlns:xenc="http://www.w3.org/2001/04/xmlenc#" Type="http://www.w3.org/2001/04/xmlenc#Content"><xenc:EncryptionMethod Algorithm="http://www.w3.org/2001/04/xmlenc#tripledes-cbc" xmlns:xenc="http://www.w3.org/2001/04/xmlenc#"/><xenc:CipherData xmlns:xenc="http://www.w3.org/2001/04/xmlenc#"><xenc:CipherValue xmlns:xenc="http://www.w3.org/2001/04/xmlenc#">l2emktZ5RmZbx6gcwoW95w==</xenc:CipherValue></xenc:CipherData></xenc:EncryptedData></Preambula>
    <SimbolickiNaziv/>
    <Naziv/>
    <UvodniDeo>
        <RedniBrojDela>1</RedniBrojDela>
        <SimbolickiNazivDela/>
        <NazivDela/>
        <Glava>
            <RedniBrojGlave>1</RedniBrojGlave>
            <SimbolickiNazivGlave/>
            <NazivGlave/>
            <OdeljakIliClan><Clan>
                <RedniBrojClana/>
                <SimbolickiNazivClana/>
                <StavClana>
                    <TekstStava/>
                </StavClana>
            </Clan></OdeljakIliClan>
        </Glava>
        <PredmetUredjivanja/>
    </UvodniDeo>
    <GlavniDeo>
        <RedniBrojDela>1</RedniBrojDela>
        <SimbolickiNazivDela/>
        <NazivDela/>
        <Glava>
            <RedniBrojGlave>1</RedniBrojGlave>
            <SimbolickiNazivGlave/>
            <NazivGlave/>
            <OdeljakIliClan><Clan>
                <RedniBrojClana/>
                <SimbolickiNazivClana/>
                <StavClana>
                    <TekstStava/>
                </StavClana>
            </Clan></OdeljakIliClan>
        </Glava>
    </GlavniDeo>
    <ZavrsniDeo>
        <RedniBrojDela>1</RedniBrojDela>
        <SimbolickiNazivDela/>
        <NazivDela/>
        <Glava>
            <RedniBrojGlave>1</RedniBrojGlave>
            <SimbolickiNazivGlave/>
            <NazivGlave/>
            <OdeljakIliClan><Clan>
                <RedniBrojClana/>
                <SimbolickiNazivClana/>
                <StavClana>
                    <TekstStava/>
                </StavClana>
            </Clan></OdeljakIliClan>
        </Glava>
    </ZavrsniDeo>
</Propis>